{
  "$schema": "https://json-schema.org/draft/2020-12/schema",
  "$id": "https://github.com/kody-w/rapp-workspace/raw/main/protocols/rapp-work-organization/1/schemas/wild-handshake-binding.schema.json",
  "type": "object",
  "properties": {
    "schema": {
      "const": "rapp-work-organization/1/wild-handshake-binding"
    },
    "id": {
      "const": "softwarecoellc-vteam-hive"
    },
    "status": {
      "const": "owner-approved-private"
    },
    "embedded_private_content": {
      "const": false
    },
    "handshake_profile": {
      "$ref": "common.schema.json#/$defs/artifactPin"
    },
    "source_lens": {
      "$ref": "common.schema.json#/$defs/artifactPin"
    },
    "target_finalizer": {
      "$ref": "common.schema.json#/$defs/artifactPin"
    },
    "contract": {
      "$ref": "common.schema.json#/$defs/artifactPin"
    },
    "source": {
      "type": "object",
      "properties": {
        "repository": {
          "const": "https://github.com/billwhalenmsft/softwarecoellc-vteam-hive"
        },
        "commit": {
          "$ref": "common.schema.json#/$defs/gitHash"
        },
        "profile": {
          "const": "microsol-project/1"
        },
        "verified_frames": {
          "const": 2
        },
        "verified_artifacts": {
          "const": 9
        }
      },
      "required": [
        "repository",
        "commit",
        "profile",
        "verified_frames",
        "verified_artifacts"
      ],
      "additionalProperties": false
    },
    "proof": {
      "type": "object",
      "properties": {
        "double_hotload": {
          "const": "verified-local"
        },
        "compatibility_frame": {
          "const": "verified-local-private"
        },
        "static_agent": {
          "const": "verified-local-private"
        },
        "model_calls_static_runtime": {
          "const": 0
        }
      },
      "required": [
        "double_hotload",
        "compatibility_frame",
        "static_agent",
        "model_calls_static_runtime"
      ],
      "additionalProperties": false
    },
    "generic_ceo_agent": {
      "type": "object",
      "properties": {
        "status": {
          "const": "verified"
        },
        "sha256": {
          "const": "827f637c024e3fa1229148e5dcd78230a84ea3214283f899d22603741350f23c"
        },
        "bytes": {
          "const": 430291
        },
        "skill_sha256": {
          "const": "5f8bd5b3c48858329f87ae3812dbc30ee604cb664985dc3d42a79e69d8bdfda8"
        },
        "skill_bytes": {
          "const": 39139
        },
        "artifact_profile_sha256": {
          "const": "568bb863d3c3f01109f6a4a40a56833127c6d6e509ef09b5433a40d92a83065a"
        }
      },
      "required": [
        "status",
        "sha256",
        "bytes",
        "skill_sha256",
        "skill_bytes",
        "artifact_profile_sha256"
      ],
      "additionalProperties": false
    },
    "authority": {
      "const": false
    }
  },
  "required": [
    "schema",
    "id",
    "status",
    "embedded_private_content",
    "handshake_profile",
    "source_lens",
    "target_finalizer",
    "contract",
    "source",
    "proof",
    "generic_ceo_agent",
    "authority"
  ],
  "additionalProperties": false
}
